Item Type;Publication Year;Publication Title;Author;Title;Date;Url;ISBN;ISSN;DOI;;;;;;;;;;;;;;;;;;;;;;;;;;;;;;;;;;;;;;;;;;;;;;;;
blogPost;2000;News From Google;Google;Google Launches Self-Service Advertising Program;23/10/2000;http://googlepress.blogspot.com/2000/10/google-launches-self-service.html;;;;;;;;;;;;;;;;;;;;;;;;;;;;;;;;;;;;;;;;;;;;;;;;;;;
blogPost;2007;blog.pmarca.com;Andreessen, Marc;The three kinds of platforms you meet on the Internet;02/10/2007;https://web.archive.org/web/20071002031605/http:/blog.pmarca.com/2007/09/the-three-kinds.html;;;;;;;;;;;;;;;;;;;;;;;;;;;;;;;;;;;;;;;;;;;;;;;;;;;
blogPost;2007;Google Online Security Blog;"Rakowski, Brian; Casto, Garret";Phishers and Malware authors beware!;18/06/2007;https://security.googleblog.com/2007/06/phishers-and-malware-authors-beware.html;;;;;;;;;;;;;;;;;;;;;;;;;;;;;;;;;;;;;;;;;;;;;;;;;;;
blogPost;2007;Official Gmail Blog;Taylor, Brad;Thanks for all the spam reports;19/07/2007;https://gmail.googleblog.com/2007/07/thanks-for-all-spam-reports.html;;;;;;;;;;;;;;;;;;;;;;;;;;;;;;;;;;;;;;;;;;;;;;;;;;;
blogPost;2009;Official Google Blog;"Walker, K; Wojcicki, S";Making ads more interesting;11/03/2009;https://googleblog.blogspot.com/2009/03/making-ads-more-interesting.html;;;;;;;;;;;;;;;;;;;;;;;;;;;;;;;;;;;;;;;;;;;;;;;;;;;
blogPost;2010;Google Online Security Blog;Mehta, Neel;The chilling effects of malware;30/03/2010;https://security.googleblog.com/2010/03/chilling-effects-of-malware.html;;;;;;;;;;;;;;;;;;;;;;;;;;;;;;;;;;;;;;;;;;;;;;;;;;;
blogPost;2010;Official Gmail Blog;Diwanji, Pavni;Detecting suspicious account activity;24/03/2010;https://gmail.googleblog.com/2010/03/detecting-suspicious-account-activity.html;;;;;;;;;;;;;;;;;;;;;;;;;;;;;;;;;;;;;;;;;;;;;;;;;;;
blogPost;2010;Official Google Blog;Drummond, David;A new approach to China: an update;22/03/2010;https://googleblog.blogspot.com/2010/03/new-approach-to-china-update.html;;;;;;;;;;;;;;;;;;;;;;;;;;;;;;;;;;;;;;;;;;;;;;;;;;;
blogPost;2012;Google Online Security Blog;Grosse, Eric;Security warnings for suspected state-sponsored attacks;05/06/2012;https://security.googleblog.com/2012/06/security-warnings-for-suspected-state.html;;;;;;;;;;;;;;;;;;;;;;;;;;;;;;;;;;;;;;;;;;;;;;;;;;;
blogPost;2012;Google The Keyword;Dean, Jeff;Using large-scale brain simulations for machine learning and A.I.;26/06/2012;https://blog.google/technology/ai/using-large-scale-brain-simulations-for/;;;;;;;;;;;;;;;;;;;;;;;;;;;;;;;;;;;;;;;;;;;;;;;;;;;
blogPost;2013;Google The Keyword;Fuller, Jacquelline;Our continued commitment to combating child exploitation online;15/06/2013;https://blog.google/outreach-initiatives/google-org/our-continued-commitment-to-combating/;;;;;;;;;;;;;;;;;;;;;;;;;;;;;;;;;;;;;;;;;;;;;;;;;;;
blogPost;2013;Google The Keyword;Infantino, Susan;Transparency Report: Government removal requests continue to rise;19/12/2013;https://blog.google/outreach-initiatives/public-policy/transparency-report-government-removal/;;;;;;;;;;;;;;;;;;;;;;;;;;;;;;;;;;;;;;;;;;;;;;;;;;;
blogPost;2015;Google Online Security Blog;Sleevi, Ryan;Sustaining Digital Certificate Security;28/10/2015;https://security.googleblog.com/2015/10/sustaining-digital-certificate-security.html;;;;;;;;;;;;;;;;;;;;;;;;;;;;;;;;;;;;;;;;;;;;;;;;;;;
blogPost;2015;Google The Keyword;Salgado, Richard;New data, more facts: an update to the Transparency Report;14/05/2015;https://blog.google/outreach-initiatives/public-policy/new-data-more-facts-update-to/;;;;;;;;;;;;;;;;;;;;;;;;;;;;;;;;;;;;;;;;;;;;;;;;;;;
blogPost;2015;Official Gmail Blog;Somanchi, Sri Harscha;The mail you want, not the spam you don’t;09/07/2015;https://gmail.googleblog.com/2015/07/the-mail-you-want-not-spam-you-dont.html;;;;;;;;;;;;;;;;;;;;;;;;;;;;;;;;;;;;;;;;;;;;;;;;;;;
blogPost;2016;Google;Salgado, Richard;Sharing National Security Letters with the public;13/12/2016;https://blog.google/outreach-initiatives/public-policy/sharing-national-security-letters-public/;;;;;;;;;;;;;;;;;;;;;;;;;;;;;;;;;;;;;;;;;;;;;;;;;;;
blogPost;2016;Google Research;"Le, Quoc V.; Schuster, Mike";A Neural Network for Machine Translation, at Production Scale;27/09/2016;https://research.google/blog/a-neural-network-for-machine-translation-at-production-scale/;;;;;;;;;;;;;;;;;;;;;;;;;;;;;;;;;;;;;;;;;;;;;;;;;;;
blogPost;2016;Google The Keyword;Cohen, Jared;Protecting the world's news from digital attack;25/02/2016;https://blog.google/alphabet/protecting-worlds-news-digital-attack/;;;;;;;;;;;;;;;;;;;;;;;;;;;;;;;;;;;;;;;;;;;;;;;;;;;
blogPost;2016;Google The Keyword;Downs, Juniper;Introducing YouTube Creators for Change;22/09/2016;https://blog.google/products/youtube/introducing-youtube-creators-for-change/;;;;;;;;;;;;;;;;;;;;;;;;;;;;;;;;;;;;;;;;;;;;;;;;;;;
blogPost;2016;Google The Keyword;Junlus, Lie;Our commitment to fighting illegal hate speech online;31/05/2016;https://blog.google/around-the-globe/google-europe/our-commitment-to-fighting-illegal-hate_39/;;;;;;;;;;;;;;;;;;;;;;;;;;;;;;;;;;;;;;;;;;;;;;;;;;;
blogPost;2016;Google The Keyword;Smith, Brittany;Working together to better protect children online;14/04/2016;https://blog.google/around-the-globe/google-europe/working-together-to-better-protec/;;;;;;;;;;;;;;;;;;;;;;;;;;;;;;;;;;;;;;;;;;;;;;;;;;;
blogPost;2016;Hashed Out by The SSL Store™;Lynch, Vincent;Google Chrome to Require Certificate Transparency in 2017;28/10/2016;https://www.thesslstore.com/blog/google-chrome-certificate-transparency-2017/;;;;;;;;;;;;;;;;;;;;;;;;;;;;;;;;;;;;;;;;;;;;;;;;;;;
blogPost;2016;Intuition Machine;Perez, Carlos E.;The Emergence of Modular Deep Learning;16/12/2016;https://medium.com/intuitionmachine/the-end-of-monolithic-deep-learning-86937c86bc1f;;;;;;;;;;;;;;;;;;;;;;;;;;;;;;;;;;;;;;;;;;;;;;;;;;;
blogPost;2016;Jigsaw;Schmidt, Eric;Google Ideas Becomes Jigsaw;16/02/2016;https://medium.com/jigsaw/google-ideas-becomes-jigsaw-bcb5bd08c423;;;;;;;;;;;;;;;;;;;;;;;;;;;;;;;;;;;;;;;;;;;;;;;;;;;
blogPost;2016;Matt's Ramblings;Earl, Matthew;Number plate recognition with Tensorflow;06/05/2016;https://matthewearl.github.io/2016/05/06/cnn-anpr/;;;;;;;;;;;;;;;;;;;;;;;;;;;;;;;;;;;;;;;;;;;;;;;;;;;
blogPost;2017;blog.youtube;The YouTube Team;Bringing new Redirect Method features to YouTube;20/07/2017;https://blog.youtube/news-and-events/bringing-new-redirect-method-features/;;;;;;;;;;;;;;;;;;;;;;;;;;;;;;;;;;;;;;;;;;;;;;;;;;;
blogPost;2017;Bulletin of the Atomic Scientists;Staff, Bulletin;Project Maven brings AI to the fight against ISIS;21/12/2017;https://thebulletin.org/2017/12/project-maven-brings-ai-to-the-fight-against-isis/;;;;;;;;;;;;;;;;;;;;;;;;;;;;;;;;;;;;;;;;;;;;;;;;;;;
blogPost;2017;Google Cloud Blog;Li, Fei-Fei;Announcing Google Cloud Video Intelligence API, and more Cloud Machine Learning updates;09/03/2017;https://cloud.google.com/blog/products/gcp/announcing-google-cloud-video-intelligence-api-and-more-cloud-machine-learning-updates;;;;;;;;;;;;;;;;;;;;;;;;;;;;;;;;;;;;;;;;;;;;;;;;;;;
blogPost;2017;Google Online Security Blog;"O'Brien, Devon; Sleevi, Ryan; Whalley, Andrew";Chrome’s Plan to Distrust Symantec Certificates;11/09/2017;https://security.googleblog.com/2017/09/chromes-plan-to-distrust-symantec.html;;;;;;;;;;;;;;;;;;;;;;;;;;;;;;;;;;;;;;;;;;;;;;;;;;;
blogPost;2017;Google Research;Stone, Zak;Introducing the TensorFlow Research Cloud;17/05/2017;https://research.google/blog/introducing-the-tensorflow-research-cloud/;;;;;;;;;;;;;;;;;;;;;;;;;;;;;;;;;;;;;;;;;;;;;;;;;;;
blogPost;2017;Google The Keyword;Cohen, Jared;When computers learn to swear: Using machine learning for better online conversations;23/02/2017;https://blog.google/technology/ai/when-computers-learn-swear-using-machine-learning-better-online-conversations/;;;;;;;;;;;;;;;;;;;;;;;;;;;;;;;;;;;;;;;;;;;;;;;;;;;
blogPost;2017;Google The Keyword;Google;Update on the Global Internet Forum to Counter Terrorism;04/12/2017;https://blog.google/around-the-globe/google-europe/update-global-internet-forum-counter-terrorism/;;;;;;;;;;;;;;;;;;;;;;;;;;;;;;;;;;;;;;;;;;;;;;;;;;;
blogPost;2017;Google The Keyword;Li, Fei-Fei;Opening the Google AI China Center;13/12/2017;https://blog.google/around-the-globe/google-asia/google-ai-china-center/;;;;;;;;;;;;;;;;;;;;;;;;;;;;;;;;;;;;;;;;;;;;;;;;;;;
blogPost;2017;Google The Keyword;Molinari, Susan;Google’s fight against human trafficking;07/09/2017;https://blog.google/outreach-initiatives/public-policy/googles-fight-against-human-trafficking/;;;;;;;;;;;;;;;;;;;;;;;;;;;;;;;;;;;;;;;;;;;;;;;;;;;
blogPost;2017;Google The Keyword;"Risher, Mark; Miller, Allison";Fighting phishing with smarter protections;18/10/2017;https://blog.google/technology/safety-security/fighting-phishing-smarter-protections/;;;;;;;;;;;;;;;;;;;;;;;;;;;;;;;;;;;;;;;;;;;;;;;;;;;
blogPost;2017;Google The Keyword;Rogers, Simon;A new machine learning app for reporting on hate in America;18/08/2017;https://blog.google/outreach-initiatives/google-news-initiative/new-machine-learning-app-reporting-hate-america/;;;;;;;;;;;;;;;;;;;;;;;;;;;;;;;;;;;;;;;;;;;;;;;;;;;
blogPost;2017;Google The Keyword;Salgado, Richard;New government removals and National Security Letter data;07/12/2017;https://blog.google/outreach-initiatives/public-policy/new-government-removals-and-national-security-letter-data/;;;;;;;;;;;;;;;;;;;;;;;;;;;;;;;;;;;;;;;;;;;;;;;;;;;
blogPost;2017;Google The Keyword;Walker, Kent;An international framework for digital evidence;20/04/2017;https://blog.google/outreach-initiatives/public-policy/international-framework-digital-evidence/;;;;;;;;;;;;;;;;;;;;;;;;;;;;;;;;;;;;;;;;;;;;;;;;;;;
blogPost;2017;Google The Keyword;Walker, Kent;Four steps we’re taking today to fight terrorism online;18/06/2017;https://blog.google/around-the-globe/google-europe/four-steps-were-taking-today-fight-online-terror/;;;;;;;;;;;;;;;;;;;;;;;;;;;;;;;;;;;;;;;;;;;;;;;;;;;
blogPost;2017;Google The Keyword;Walker, Kent;Digital security and due process: A new legal framework for the cloud era;22/06/2017;https://blog.google/outreach-initiatives/public-policy/digital-security-and-due-process-new-legal-framework-cloud-era/;;;;;;;;;;;;;;;;;;;;;;;;;;;;;;;;;;;;;;;;;;;;;;;;;;;
blogPost;2017;Google The Keyword;Walker, Kent;Defending access to lawful information at Europe’s highest court;15/11/2017;https://blog.google/around-the-globe/google-europe/defending-access-lawful-information-europes-highest-court/;;;;;;;;;;;;;;;;;;;;;;;;;;;;;;;;;;;;;;;;;;;;;;;;;;;
blogPost;2017;Google The Keyword;"Walker, Kent; Salgado, Richard";Security and disinformation in the U.S. 2016 election;30/10/2017;https://blog.google/outreach-initiatives/public-policy/security-and-disinformation-us-2016-election/;;;;;;;;;;;;;;;;;;;;;;;;;;;;;;;;;;;;;;;;;;;;;;;;;;;
blogPost;2017;Hashed Out by The SSL Store™;Lynch, Vincent;DigiCert Will Acquire Symantec’s Certificate Authority;03/08/2017;https://www.thesslstore.com/blog/digicert-symantec-acquisition/;;;;;;;;;;;;;;;;;;;;;;;;;;;;;;;;;;;;;;;;;;;;;;;;;;;
blogPost;2017;Jigsaw;Jigsaw;Jigsaw Turns One;16/02/2017;https://medium.com/jigsaw/jigsaw-turns-one-b9f05902a05b;;;;;;;;;;;;;;;;;;;;;;;;;;;;;;;;;;;;;;;;;;;;;;;;;;;
blogPost;2017;Jigsaw;Jigsaw;Algorithms And Insults: Scaling Up Our Understanding Of Harassment On Wikipedia;29/08/2017;https://medium.com/jigsaw/algorithms-and-insults-scaling-up-our-understanding-of-harassment-on-wikipedia-6cc417b9f7ff;;;;;;;;;;;;;;;;;;;;;;;;;;;;;;;;;;;;;;;;;;;;;;;;;;;
blogPost;2017;Jigsaw;Jigsaw;Protect Your Election: Helping Everyone Get The Full Story;29/08/2017;https://medium.com/jigsaw/protect-your-election-helping-everyone-get-the-full-story-faea40934dd2;;;;;;;;;;;;;;;;;;;;;;;;;;;;;;;;;;;;;;;;;;;;;;;;;;;
blogPost;2017;Twitter Blog;Twitter Public Policy;Global Internet Forum to Counter Terrorism;26/06/2017;https://blog.x.com/en_us/topics/company/2017/Global-Internet-Forum-to-Counter-Terrorism;;;;;;;;;;;;;;;;;;;;;;;;;;;;;;;;;;;;;;;;;;;;;;;;;;;
blogPost;2017;YouTube Official Blog;The YouTube Team;An update on our commitment to fight violent extremist content online;01/08/2017;https://blog.youtube/news-and-events/an-update-on-our-commitment-to-fight/;;;;;;;;;;;;;;;;;;;;;;;;;;;;;;;;;;;;;;;;;;;;;;;;;;;
blogPost;2017;YouTube official blog;Wojcicki, Susan;Expanding our work against abuse of our platform;05/12/2017;https://blog.youtube/news-and-events/expanding-our-work-against-abuse-of-our/;;;;;;;;;;;;;;;;;;;;;;;;;;;;;;;;;;;;;;;;;;;;;;;;;;;
blogPost;2018;Analytics Vidhya;Shaikh, Faizan;Essentials of Deep Learning: Introduction to Unsupervised Deep Learning (with Python codes);06/05/2018;https://www.analyticsvidhya.com/blog/2018/05/essentials-of-deep-learning-trudging-into-unsupervised-deep-learning/;;;;;;;;;;;;;;;;;;;;;;;;;;;;;;;;;;;;;;;;;;;;;;;;;;;
blogPost;2018;Google Online Security Blog;Bursztein, Elie;Leveraging AI to protect our users and the web;10/04/2018;https://security.googleblog.com/2018/04/leveraging-ai-to-protect-our-users-and.html;;;;;;;;;;;;;;;;;;;;;;;;;;;;;;;;;;;;;;;;;;;;;;;;;;;
blogPost;2018;Google Online Security Blog;Huntley, Shane;A reminder about government-backed phishing;20/08/2018;https://security.googleblog.com/2018/08/a-reminder-about-government-backed.html;;;;;;;;;;;;;;;;;;;;;;;;;;;;;;;;;;;;;;;;;;;;;;;;;;;
blogPost;2018;Google Online Security Blog;Tetali, Sai Deep;Keeping 2 billion Android devices safe with machine learning;24/05/2018;https://security.googleblog.com/2018/05/keeping-2-billion-android-devices-safe.html;;;;;;;;;;;;;;;;;;;;;;;;;;;;;;;;;;;;;;;;;;;;;;;;;;;
blogPost;2018;Google Research;Wexler, James;The What-If Tool: Code-Free Probing of Machine Learning Models;11/09/2018;https://research.google/blog/the-what-if-tool-code-free-probing-of-machine-learning-models/;;;;;;;;;;;;;;;;;;;;;;;;;;;;;;;;;;;;;;;;;;;;;;;;;;;
blogPost;2018;Google The Keyword;Lewin, Sarah;Bringing online safety education programs to UK schools;27/02/2018;https://blog.google/technology/families/bringing-online-safety-education-programs-uk-schools/;;;;;;;;;;;;;;;;;;;;;;;;;;;;;;;;;;;;;;;;;;;;;;;;;;;
blogPost;2018;Google The Keyword;Lieber, David;Updating government access laws for the digital age;23/07/2018;https://blog.google/outreach-initiatives/public-policy/updating-government-access-laws-digital-age/;;;;;;;;;;;;;;;;;;;;;;;;;;;;;;;;;;;;;;;;;;;;;;;;;;;
blogPost;2018;Google The Keyword;Lin, Jennifer;Building on our cloud security leadership to help keep businesses protected;25/07/2018;https://blog.google/products/google-cloud/building-on-our-cloud-security-leadership-to-help-keep-businesses-protected/;;;;;;;;;;;;;;;;;;;;;;;;;;;;;;;;;;;;;;;;;;;;;;;;;;;
blogPost;2018;Google The Keyword;Phillips, Eve;Managing and securing cloud workers with new updates to Chrome Enterprise;19/07/2018;https://blog.google/products/chrome-enterprise/managing-and-securing-cloud-workers-with-new-updates-to-chrome-enterprise/;;;;;;;;;;;;;;;;;;;;;;;;;;;;;;;;;;;;;;;;;;;;;;;;;;;
blogPost;2018;Google The Keyword;Pichai, Sundar;Solving problems with AI for everyone;08/05/2018;https://blog.google/technology/ai/io18-overview/;;;;;;;;;;;;;;;;;;;;;;;;;;;;;;;;;;;;;;;;;;;;;;;;;;;
blogPost;2018;Google The Keyword;"Todorovic, Nikola; Chaudhuri, abhi";Using AI to help organizations detect and report child sexual abuse material online;03/09/2018;https://blog.google/around-the-globe/google-europe/using-ai-help-organizations-detect-and-report-child-sexual-abuse-material-online/;;;;;;;;;;;;;;;;;;;;;;;;;;;;;;;;;;;;;;;;;;;;;;;;;;;
blogPost;2018;Google The Keyword;Walker, Kent;An update on state-sponsored activity;23/08/2018;https://blog.google/technology/safety-security/update-state-sponsored-activity/;;;;;;;;;;;;;;;;;;;;;;;;;;;;;;;;;;;;;;;;;;;;;;;;;;;
blogPost;2018;Google The Keyword;Walker, Kent;Our testimony to the U.S. Senate Select Committee on Intelligence;04/09/2018;https://blog.google/outreach-initiatives/public-policy/our-testimony-us-senate-select-committee-intelligence/;;;;;;;;;;;;;;;;;;;;;;;;;;;;;;;;;;;;;;;;;;;;;;;;;;;
blogPost;2018;Hashed Out by The SSL Store™;Nohe, Patrick;Final Warning: Last chance to replace Symantec SSL certificates;09/10/2018;https://www.thesslstore.com/blog/final-warning-last-chance-to-replace-symantec-ssl-certificates/;;;;;;;;;;;;;;;;;;;;;;;;;;;;;;;;;;;;;;;;;;;;;;;;;;;
blogPost;2018;Hashed Out by The SSL Store™;Nohe, Patrick;The difference between Encryption, Hashing and Salting;19/12/2018;https://www.thesslstore.com/blog/difference-encryption-hashing-salting/;;;;;;;;;;;;;;;;;;;;;;;;;;;;;;;;;;;;;;;;;;;;;;;;;;;
blogPost;2018;ICRAC;Researchers in Support of Google Employees;Open Letter in Support of Google Employees and Tech Workers;17/05/2018;https://www.icrac.net/open-letter-in-support-of-google-employees-and-tech-workers/;;;;;;;;;;;;;;;;;;;;;;;;;;;;;;;;;;;;;;;;;;;;;;;;;;;
blogPost;2018;Inverted Passion;Chopra, Author Paras;On the inefficiency of machine learning algorithms;03/07/2018;https://invertedpassion.com/inefficiency-machine-learning-algorithms/;;;;;;;;;;;;;;;;;;;;;;;;;;;;;;;;;;;;;;;;;;;;;;;;;;;
blogPost;2018;Learning Machine Learning;Mayeesha, Tahsin;Introduction to Tensorflow Estimators;17/08/2018;https://medium.com/learning-machine-learning/introduction-to-tensorflow-estimators-part-1-39f9eb666bc7;;;;;;;;;;;;;;;;;;;;;;;;;;;;;;;;;;;;;;;;;;;;;;;;;;;
blogPost;2018;Medium;Gillett, Stephen;Give Good the Advantage;14/12/2018;https://medium.com/chronicle-blog/give-good-the-advantage-75ab2c242e45;;;;;;;;;;;;;;;;;;;;;;;;;;;;;;;;;;;;;;;;;;;;;;;;;;;
blogPost;2018;Medium;Kumar, Naveen;Beginner’s guide to TensorFlow;09/07/2018;https://medium.com/@naveenkb/beginners-guide-to-tensorflow-by-a-beginner-ebb93e521ece;;;;;;;;;;;;;;;;;;;;;;;;;;;;;;;;;;;;;;;;;;;;;;;;;;;
blogPost;2018;Medium;Ng, Andrew;Introducing the AI Transformation Playbook;13/12/2018;https://medium.com/@andrewng/introducing-the-ai-transformation-playbook-58ccad4393e9;;;;;;;;;;;;;;;;;;;;;;;;;;;;;;;;;;;;;;;;;;;;;;;;;;;
blogPost;2018;NVIDIA Blog;Salian, Isha;Supervised Vs. Unsupervised Learning;02/08/2018;https://34.214.249.23.nip.io/blog/supervised-unsupervised-learning/;;;;;;;;;;;;;;;;;;;;;;;;;;;;;;;;;;;;;;;;;;;;;;;;;;;
blogPost;2018;Robot Futures;Suchman, Lucy;Corporate Accountability;11/06/2018;https://robotfutures.wordpress.com/2018/06/10/corporate-accountability/;;;;;;;;;;;;;;;;;;;;;;;;;;;;;;;;;;;;;;;;;;;;;;;;;;;
blogPost;2018;TechCrunch;Lomas, Natasha;Here are the experts who will help shape Europe's AI policy;14/06/2018;https://techcrunch.com/2018/06/14/here-are-the-experts-who-will-help-shape-europes-ai-policy/;;;;;;;;;;;;;;;;;;;;;;;;;;;;;;;;;;;;;;;;;;;;;;;;;;;
blogPost;2018;TensorFlow;"Gupta, Sandeep; Gordon, Josh; Allison, Karmel";Standardizing on Keras: Guidance on High-level APIs in TensorFlow 2.0;06/12/2018;https://medium.com/tensorflow/standardizing-on-keras-guidance-on-high-level-apis-in-tensorflow-2-0-bad2b04c819a;;;;;;;;;;;;;;;;;;;;;;;;;;;;;;;;;;;;;;;;;;;;;;;;;;;
blogPost;2018;TensorFlow Blog;Gordon, Josh;Introducing TensorFlow Hub: A Library for Reusable Machine Learning Modules in TensorFlow;30/03/2018;https://blog.tensorflow.org/2018/03/introducing-tensorflow-hub-library.html;;;;;;;;;;;;;;;;;;;;;;;;;;;;;;;;;;;;;;;;;;;;;;;;;;;
blogPost;2018;The Hill;Beavers, Olivia;Artificial intelligence debate flares at Google;05/06/2018;https://thehill.com/policy/technology/390877-artificial-intelligence-debate-flares-at-google/;;;;;;;;;;;;;;;;;;;;;;;;;;;;;;;;;;;;;;;;;;;;;;;;;;;
blogPost;2018;VentureBeat;Wiggers, Kyle;IBM collaborated with the NYPD on an AI system that can search for people by race;06/09/2018;https://venturebeat.com/ai/ibm-collaborated-with-the-nydp-on-an-ai-system-that-can-search-for-people-by-race/;;;;;;;;;;;;;;;;;;;;;;;;;;;;;;;;;;;;;;;;;;;;;;;;;;;
blogPost;2018;YouTube official blog;"Mohan, Neal; Kyncl, Robert";Building a better news experience on YouTube, together;09/07/2018;https://blog.youtube/news-and-events/building-better-news-experience-on/;;;;;;;;;;;;;;;;;;;;;;;;;;;;;;;;;;;;;;;;;;;;;;;;;;;
blogPost;2019;FedScoop;Mitchell, Billy;The 'silver lining' in the fallout between Google and Project Maven;10/12/2019;https://fedscoop.com/project-maven-silver-lining-peter-thiel/;;;;;;;;;;;;;;;;;;;;;;;;;;;;;;;;;;;;;;;;;;;;;;;;;;;
blogPost;2019;Google the;Vaccarono, Fabio;A new tool to help Italian companies grow with AI;26/09/2019;https://blog.google/outreach-initiatives/grow-with-google/machine-learning-checkup-italy/;;;;;;;;;;;;;;;;;;;;;;;;;;;;;;;;;;;;;;;;;;;;;;;;;;;
blogPost;2019;Hashed Out by The SSL Store™;Nohe, Patrick;Mass Revocation: Millions of certificates revoked by Apple, Google & GoDaddy;13/03/2019;https://www.thesslstore.com/blog/mass-revocation-millions-of-certificates-revoked-by-apple-google-godaddy/;;;;;;;;;;;;;;;;;;;;;;;;;;;;;;;;;;;;;;;;;;;;;;;;;;;
blogPost;2019;Hashed Out by The SSL Store™;Nohe, Patrick;Taking a Closer Look at the SSL Handshake;30/04/2019;https://www.thesslstore.com/blog/explaining-ssl-handshake/;;;;;;;;;;;;;;;;;;;;;;;;;;;;;;;;;;;;;;;;;;;;;;;;;;;
blogPost;2019;Medium;Tanner, Gilbert;Simple Surveillance System with the Tensorflow Object Detection API;21/07/2019;https://towardsdatascience.com/simple-surveillance-system-with-the-tensorflow-object-detection-api-125e04d36446;;;;;;;;;;;;;;;;;;;;;;;;;;;;;;;;;;;;;;;;;;;;;;;;;;;
blogPost;2019;Medium;Zaid, Muhammad;TensorFlow is in a relationship with Keras — Introducing TF 2.0;06/10/2019;https://towardsdatascience.com/tensorflow-is-in-a-relationship-with-keras-introducing-tf-2-0-dcf1228f73ae;;;;;;;;;;;;;;;;;;;;;;;;;;;;;;;;;;;;;;;;;;;;;;;;;;;
blogPost;2019;New Statesman;Williams, Oscar;How Big Tech funds the debate on AI ethics;06/06/2019;https://www.newstatesman.com/science-tech/2019/06/how-big-tech-funds-debate-ai-ethics;;;;;;;;;;;;;;;;;;;;;;;;;;;;;;;;;;;;;;;;;;;;;;;;;;;
blogPost;2019;TechCrunch;Hatmaker, Taylor;Palantir wins $800 million contract to build the US Army's next battlefield software system;28/03/2019;https://techcrunch.com/2019/03/27/palantir-army-contract-dcgs-a/;;;;;;;;;;;;;;;;;;;;;;;;;;;;;;;;;;;;;;;;;;;;;;;;;;;
blogPost;2019;TensorFlow Blog;"Crowe, Robert; Katsiapis, Konstantinos; Haas, Kevin";TensorFlow Extended (TFX): Real World Machine Learning in Production;26/06/2019;https://blog.tensorflow.org/2019/06/tensorflow-extended-tfx-real-world_26.html;;;;;;;;;;;;;;;;;;;;;;;;;;;;;;;;;;;;;;;;;;;;;;;;;;;
blogPost;2019;TensorFlow Blog;Grimstad, Jordan;An Introduction to the New and Improved TensorFlow Hub;19/12/2019;https://blog.tensorflow.org/2019/12/an-introduction-to-new-and-improved.html;;;;;;;;;;;;;;;;;;;;;;;;;;;;;;;;;;;;;;;;;;;;;;;;;;;
blogPost;2019;TensorFlow Blog;"Poorazizi, Abraham; Khordoo, Mahmood; Amini, Mahsa";Disaster Watch: a crisis mapping platform to collect, evaluate, and publish disaster-related tweets;02/09/2019;https://blog.tensorflow.org/2019/09/disaster-watch-crisis-mapping-platform.html;;;;;;;;;;;;;;;;;;;;;;;;;;;;;;;;;;;;;;;;;;;;;;;;;;;
blogPost;2019;TensorFlow Blog;"Radebaugh, Carey; Erlingsson, Ulfar";Introducing TensorFlow Privacy: Learning with Differential Privacy for Training Data;06/03/2019;https://blog.tensorflow.org/2019/03/introducing-tensorflow-privacy-learning.html;;;;;;;;;;;;;;;;;;;;;;;;;;;;;;;;;;;;;;;;;;;;;;;;;;;
blogPost;2019;TensorFlow Blog;TensorFlow;Introducing TensorFlow Datasets;26/02/2019;https://blog.tensorflow.org/2019/02/introducing-tensorflow-datasets.html;;;;;;;;;;;;;;;;;;;;;;;;;;;;;;;;;;;;;;;;;;;;;;;;;;;
blogPost;2019;TensorFlow Blog;"Zhuang, Yi; Thiagarajan, Arvind; Sweeney, Tim";Ranking Tweets with TensorFlow;04/03/2019;https://blog.tensorflow.org/2019/03/ranking-tweets-with-tensorflow.html;;;;;;;;;;;;;;;;;;;;;;;;;;;;;;;;;;;;;;;;;;;;;;;;;;;
blogPost;2019;VentureBeat;Johnson, Khari;The U.S. military, algorithmic warfare, and big tech;08/11/2019;https://venturebeat.com/ai/the-u-s-military-algorithmic-warfare-and-big-tech/;;;;;;;;;;;;;;;;;;;;;;;;;;;;;;;;;;;;;;;;;;;;;;;;;;;
blogPost;2020;Google Cloud Blog;"Lewi, Jeremy; Gupta, Abhishek";Run ML workflows in production with cloud-native toolkit Kubeflow 1.0;03/03/2020;https://cloud.google.com/blog/products/ai-machine-learning/run-ml-workflows-in-production-with-cloud-native-toolkit-kubeflow-1-0;;;;;;;;;;;;;;;;;;;;;;;;;;;;;;;;;;;;;;;;;;;;;;;;;;;
blogPost;2020;Hashed Out by The SSL Store™;Crane, Casey;Let’s Encrypt to Revoke 3 Million SSL Certificates on March 4;03/03/2020;https://www.thesslstore.com/blog/lets-encrypt-to-revoke-3-million-ssl-certificates-on-march-4/;;;;;;;;;;;;;;;;;;;;;;;;;;;;;;;;;;;;;;;;;;;;;;;;;;;
blogPost;2020;Hashed Out by The SSL Store™;Crane, Casey;Google Chrome to Join Apple’s Safari in One Year Certificate Validity;15/06/2020;https://www.thesslstore.com/blog/google-chrome-to-join-apple-safari-in-one-year-certificate-validity/;;;;;;;;;;;;;;;;;;;;;;;;;;;;;;;;;;;;;;;;;;;;;;;;;;;
blogPost;2020;Hashed Out by The SSL Store™;Crane, Casey;CRL Explained: What Is a Certificate Revocation List?;22/07/2020;https://www.thesslstore.com/blog/crl-explained-what-is-a-certificate-revocation-list/;;;;;;;;;;;;;;;;;;;;;;;;;;;;;;;;;;;;;;;;;;;;;;;;;;;
blogPost;2020;InfoSec Insights;Crane, Casey;What Is an X.509 Certificate? What to Know About PKI Certificates;22/09/2020;https://sectigostore.com/blog/what-is-an-x-509-certificate-what-to-know-about-pki-certificates/;;;;;;;;;;;;;;;;;;;;;;;;;;;;;;;;;;;;;;;;;;;;;;;;;;;
blogPost;2020;InfoSec Insights;Crane, Casey;What Is a Certificate Authority? Certification Authorities Explained;14/12/2020;https://sectigostore.com/blog/what-is-a-certificate-authority-certification-authorities-explained/;;;;;;;;;;;;;;;;;;;;;;;;;;;;;;;;;;;;;;;;;;;;;;;;;;;
blogPost;2020;InfoSec Insights;Lewis, Danny;What Is PKI? A Layman’s Guide to Public Key Infrastructure;07/04/2020;https://sectigostore.com/blog/what-is-pki-a-laymans-guide-to-public-key-infrastructure/;;;;;;;;;;;;;;;;;;;;;;;;;;;;;;;;;;;;;;;;;;;;;;;;;;;
