Item Type;Publication Year;Publication Title;Author;Title;Date;Url;ISBN;ISSN;DOI;;;;;;;;;;;;;;;;;;;;;;;;;;;;;;;;;;;;;;;;;;;;;;;;
webpage;2018;The Intercept;Gallagher, Ryan;Google CEO Hammered by Members of Congress on China Censorship Plan;11/12/2018;https://theintercept.com/2018/12/11/google-congressional-hearing/;;;;;;;;;;;;;;;;;;;;;;;;;;;;;;;;;;;;;;;;;;;;;;;;;;;
webpage;2018;The Intercept;Gallagher, Ryan;"Google's Secret China Project ""Effectively Ended"" After Internal Confrontation";17/12/2018;https://theintercept.com/2018/12/17/google-china-censored-search-engine-2/;;;;;;;;;;;;;;;;;;;;;;;;;;;;;;;;;;;;;;;;;;;;;;;;;;;
webpage;2018;The Verge;Ong, Thuy;Raleigh police are asking Google to turn over details of devices close to crime scenes;19/03/2018;https://www.theverge.com/2018/3/19/17138846/google-police-location-data-crime-scenes;;;;;;;;;;;;;;;;;;;;;;;;;;;;;;;;;;;;;;;;;;;;;;;;;;;
webpage;2018;The Verge;Vincent, James;Google is using its AI skills to help the Pentagon learn to analyze drone footage;06/03/2018;https://www.theverge.com/2018/3/6/17086276/google-ai-military-drone-analysis-pentagon-project-maven-tensorfow;;;;;;;;;;;;;;;;;;;;;;;;;;;;;;;;;;;;;;;;;;;;;;;;;;;
webpage;2018;TIME;Abramson, Alana;Google Spent Millions More Than its Rivals Lobbying Politicians Last Year;24/01/2018;https://time.com/5116226/google-lobbying-2017/;;;;;;;;;;;;;;;;;;;;;;;;;;;;;;;;;;;;;;;;;;;;;;;;;;;
webpage;2018;;Magnuson, Stew;Dunford Slams Google for Working with China, But Not U.S. Military;18/11/2018;https://www.nationaldefensemagazine.org/articles/2018/11/18/dunford-slams-google-for-working-with-china-but-not-us-military;;;;;;;;;;;;;;;;;;;;;;;;;;;;;;;;;;;;;;;;;;;;;;;;;;;
webpage;2018;;;180620 Congressional Letter to Mr Sundar Pichai - DocumentCloud;20/06/2018;https://www.documentcloud.org/documents/4529987-180620-Congressional-Letter-to-Mr-Sundar-Pichai.html;;;;;;;;;;;;;;;;;;;;;;;;;;;;;;;;;;;;;;;;;;;;;;;;;;;
webpage;2019;#TFWorld TF 2.0 Challenge!;TensorFlow;#TFWorld TF 2.0 Challenge!;2019;https://tfworld.devpost.com/;;;;;;;;;;;;;;;;;;;;;;;;;;;;;;;;;;;;;;;;;;;;;;;;;;;
webpage;2019;Adem Caudill;Caudill, Adam;TLS: 64bit-ish Serial Numbers & Mass Revocation;10/03/2019;https://adamcaudill.com/2019/03/09/tls-64bit-ish-serial-numbers-mass-revocation/;;;;;;;;;;;;;;;;;;;;;;;;;;;;;;;;;;;;;;;;;;;;;;;;;;;
webpage;2019;Ars Technica;Goodin, Dan;A world of hurt after GoDaddy, Apple, and Google misissue >1 million certificates;12/03/2019;https://arstechnica.com/information-technology/2019/03/godaddy-apple-and-google-goof-results-in-1-million-misissued-certificates/;;;;;;;;;;;;;;;;;;;;;;;;;;;;;;;;;;;;;;;;;;;;;;;;;;;
webpage;2019;Bugzilla;Sleevi, Ryan;1535871 - PKIoverheid: KPN Insufficient Serial Number Entropy;23/07/2019;https://bugzilla.mozilla.org/show_bug.cgi?id=1535871;;;;;;;;;;;;;;;;;;;;;;;;;;;;;;;;;;;;;;;;;;;;;;;;;;;
webpage;2019;Bugzilla;van den Berge, Jochem;1535871 - PKIoverheid: KPN Insufficient Serial Number Entropy;13/03/2019;https://bugzilla.mozilla.org/show_bug.cgi?id=1535871;;;;;;;;;;;;;;;;;;;;;;;;;;;;;;;;;;;;;;;;;;;;;;;;;;;
webpage;2019;Bugzilla;;1532842 - Google Trust Services: 63 bit serial numbers in some certificates;05/03/2019;https://bugzilla.mozilla.org/show_bug.cgi?id=1532842;;;;;;;;;;;;;;;;;;;;;;;;;;;;;;;;;;;;;;;;;;;;;;;;;;;
webpage;2019;Bugzilla;;1533655 - DigiCert: Apple: Non-compliant Serial Numbers;07/03/2019;https://bugzilla.mozilla.org/show_bug.cgi?id=1533655;;;;;;;;;;;;;;;;;;;;;;;;;;;;;;;;;;;;;;;;;;;;;;;;;;;
webpage;2019;Bugzilla;;1533774 - GoDaddy: Insufficient serial number entropy;08/03/2019;https://bugzilla.mozilla.org/show_bug.cgi?id=1533774;;;;;;;;;;;;;;;;;;;;;;;;;;;;;;;;;;;;;;;;;;;;;;;;;;;
webpage;2019;Bugzilla;;1535871 - PKIoverheid: KPN Insufficient Serial Number Entropy;16/03/2019;https://bugzilla.mozilla.org/show_bug.cgi?id=1535871;;;;;;;;;;;;;;;;;;;;;;;;;;;;;;;;;;;;;;;;;;;;;;;;;;;
webpage;2019;Bugzilla;;1532842 - Google Trust Services: 63 bit serial numbers in some certificates;05/03/2019;https://bugzilla.mozilla.org/show_bug.cgi?id=1532842;;;;;;;;;;;;;;;;;;;;;;;;;;;;;;;;;;;;;;;;;;;;;;;;;;;
webpage;2019;Bugzilla;;1533655 - DigiCert: Apple: Non-compliant Serial Numbers;07/03/2019;https://bugzilla.mozilla.org/show_bug.cgi?id=1533655;;;;;;;;;;;;;;;;;;;;;;;;;;;;;;;;;;;;;;;;;;;;;;;;;;;
webpage;2019;Business Insider;Peterson, Becky;Palantir grabbed Project Maven defense contract after Google left the program: sources;12/10/2019;https://www.businessinsider.com/palantir-took-over-from-google-on-project-maven-2019-12;;;;;;;;;;;;;;;;;;;;;;;;;;;;;;;;;;;;;;;;;;;;;;;;;;;
webpage;2019;Business Insider Nederland;"Hartmans, Avery; Meisenzahl, Mary";Here are all the companies and divisions under Google's parent company, Alphabet, which just had a major shake-up at the top;04/12/2019;https://www.businessinsider.nl/alphabet-google-company-list-2017-4/;;;;;;;;;;;;;;;;;;;;;;;;;;;;;;;;;;;;;;;;;;;;;;;;;;;
webpage;2019;C-SPAN.org;Walker, Kent;National Security Commission on Artificial Intelligence Conference, Public-Private Partnerships;11/05/2019;https://www.c-span.org/video/?466064-2/national-security-commission-artificial-intelligence-conference-public-private-partnerships&event=466064&playEvent;;;;;;;;;;;;;;;;;;;;;;;;;;;;;;;;;;;;;;;;;;;;;;;;;;;
webpage;2019;C4ISRNet;Atherton, Kelsey;Why won’t the National Security Commission share its thoughts on AI?;15/07/2019;https://www.c4isrnet.com/artificial-intelligence/2019/07/15/national-security-commission-on-ai-meets-again/;;;;;;;;;;;;;;;;;;;;;;;;;;;;;;;;;;;;;;;;;;;;;;;;;;;
webpage;2019;CA/Browser Forum;;Ballot SC022v2: Reduce Certificate Lifetimes;10/09/2019;https://cabforum.org/2019/09/10/ballot-sc022v2-reduce-certificate-lifetimes/;;;;;;;;;;;;;;;;;;;;;;;;;;;;;;;;;;;;;;;;;;;;;;;;;;;
webpage;2019;CRN;Tsidulko, Joseph;Google Releases Anthos, Making Push Into Competitors' Clouds | CRN;09/04/2019;https://www.crn.com/news/cloud/google-releases-anthos-making-push-into-competitors-clouds;;;;;;;;;;;;;;;;;;;;;;;;;;;;;;;;;;;;;;;;;;;;;;;;;;;
webpage;2019;Defense One;Tucker, Patrick;Google Wants More Work from the Defense Department;06/11/2019;https://www.defenseone.com/technology/2019/11/google-we-want-more-work-defense-department/161133/;;;;;;;;;;;;;;;;;;;;;;;;;;;;;;;;;;;;;;;;;;;;;;;;;;;
webpage;2019;European Commission Newsroom;European Commission;Countering illegal hate speech online #NoPlace4Hate;18/03/2019;https://ec.europa.eu/newsroom/just/items/54300/en;;;;;;;;;;;;;;;;;;;;;;;;;;;;;;;;;;;;;;;;;;;;;;;;;;;
webpage;2019;Fast Company;Zuboff, Shoshana;Why Facebook and Google don't care about their scandals--or you;22/02/2019;https://www.fastcompany.com/90303274/why-facebook-and-google-wont-change;;;;;;;;;;;;;;;;;;;;;;;;;;;;;;;;;;;;;;;;;;;;;;;;;;;
webpage;2019;Forbes;Schmelzer, Ron;There’s No Such Thing As The Machine Learning Platform;12/12/2019;https://www.forbes.com/sites/cognitiveworld/2019/12/12/theres-no-such-thing-as-the-machine-learning-platform/?sh=2a1bf2d7a8dd;;;;;;;;;;;;;;;;;;;;;;;;;;;;;;;;;;;;;;;;;;;;;;;;;;;
webpage;2019;Google Cloud Blog;Frey, Tracy;Increasing transparency with Google Cloud Explainable AI;21/11/2019;https://cloud.google.com/blog/products/ai-machine-learning/google-cloud-ai-explanations-to-increase-fairness-responsibility-and-trust;;;;;;;;;;;;;;;;;;;;;;;;;;;;;;;;;;;;;;;;;;;;;;;;;;;
webpage;2019;Google Cloud Blog;Wiley, Craig;TensorFlow Enterprise: Supported, scalable, and seamless TensorFlow in the cloud;31/10/2019;https://cloud.google.com/blog/products/ai-machine-learning/introducing-tensorflow-enterprise-supported-scalable-and-seamless-tensorflow-in-the-cloud;;;;;;;;;;;;;;;;;;;;;;;;;;;;;;;;;;;;;;;;;;;;;;;;;;;
webpage;2019;Google Transparency Report;Google;Legal process for user data requests FAQs - Transparency Report Help Center;02/08/2019;https://web.archive.org/web/20190802130044/https:/support.google.com/transparencyreport/answer/7381738?hl=en&ref_topic=7380433;;;;;;;;;;;;;;;;;;;;;;;;;;;;;;;;;;;;;;;;;;;;;;;;;;;
webpage;2019;Hackster.io;Team little lookout;Person Detection with TensorFlow and Arduino;24/10/2019;https://www.hackster.io/little_lookout/person-detection-with-tensorflow-and-arduino-47ae01;;;;;;;;;;;;;;;;;;;;;;;;;;;;;;;;;;;;;;;;;;;;;;;;;;;
webpage;2019;icrc.org;ICRC;Autonomy, artificial intelligence and robotics: Technical Aspects of Human Control;20/08/2019;https://www.icrc.org/en/document/autonomy-artificial-intelligence-and-robotics-technical-aspects-human-control;;;;;;;;;;;;;;;;;;;;;;;;;;;;;;;;;;;;;;;;;;;;;;;;;;;
webpage;2019;Inc.com;Aten, Jason;This is Google's Most Important Business (No, It Isn't Search Advertising);24/07/2019;https://www.inc.com/jason-aten/this-is-googles-most-important-business-no-it-isnt-search-advertising.html;;;;;;;;;;;;;;;;;;;;;;;;;;;;;;;;;;;;;;;;;;;;;;;;;;;
webpage;2019;Kaggle;Jigsaw;Jigsaw Unintended Bias in Toxicity Classification;2019;https://kaggle.com/jigsaw-unintended-bias-in-toxicity-classification;;;;;;;;;;;;;;;;;;;;;;;;;;;;;;;;;;;;;;;;;;;;;;;;;;;
webpage;2019;Medium;Googlers Against Transphobia;Googlers Against Transphobia and Hate;08/04/2019;https://medium.com/@against.transphobia/googlers-against-transphobia-and-hate-b1b0a5dbf76;;;;;;;;;;;;;;;;;;;;;;;;;;;;;;;;;;;;;;;;;;;;;;;;;;;
webpage;2019;Medium;Hale, Jeff;Which Deep Learning Framework is Growing Fastest?;01/04/2019;https://towardsdatascience.com/which-deep-learning-framework-is-growing-fastest-3f77f14aa318;;;;;;;;;;;;;;;;;;;;;;;;;;;;;;;;;;;;;;;;;;;;;;;;;;;
webpage;2019;Mozilla Security Blog;Wilson, Kathleen;Mozilla’s Common CA Database (CCADB) promotes Transparency and Collaboration;15/04/2019;https://blog.mozilla.org/security/2019/04/15/common-ca-database-ccadb;;;;;;;;;;;;;;;;;;;;;;;;;;;;;;;;;;;;;;;;;;;;;;;;;;;
webpage;2019;Security.nl;Security.NL;Logius laat mogelijk duizenden PKIoverheid-certificaten intrekken;14/03/2019;https://www.security.nl/posting/601483/Logius+laat+mogelijk+duizenden+PKIoverheid-certificaten+intrekken;;;;;;;;;;;;;;;;;;;;;;;;;;;;;;;;;;;;;;;;;;;;;;;;;;;
webpage;2019;Security.NL;Security.NL;Logius werkt aan plan voor vervangen PKIoverheid-certificaten;22/03/2019;https://www.security.nl/posting/602663/Logius+werkt+aan+plan+voor+vervangen+PKIoverheid-certificaten;;;;;;;;;;;;;;;;;;;;;;;;;;;;;;;;;;;;;;;;;;;;;;;;;;;
webpage;2019;TechCrunch;Shieber, Jonathan;Labelbox raises $10 million for its services to support machine learning applications;09/04/2019;https://techcrunch.com/2019/04/09/labelbox-raises-10-million-for-its-services-to-support-machine-learning-applications/;;;;;;;;;;;;;;;;;;;;;;;;;;;;;;;;;;;;;;;;;;;;;;;;;;;
webpage;2019;The Atlantic;Madrigal, Alexis C.;The End of Cyberspace;01/05/2019;https://www.theatlantic.com/technology/archive/2019/05/the-end-of-cyberspace/588340/;;;;;;;;;;;;;;;;;;;;;;;;;;;;;;;;;;;;;;;;;;;;;;;;;;;
webpage;2019;The Intercept;Biddle, Sam;Pentagon Says All of Google’s Work on Drones Is Exempt From the Freedom of Information Act;25/03/2019;https://theintercept.com/2019/03/25/google-project-maven-pentagon-foia/;;;;;;;;;;;;;;;;;;;;;;;;;;;;;;;;;;;;;;;;;;;;;;;;;;;
webpage;2019;The Intercept;Fang, Lee;Google Hired Gig Economy Workers to Improve Artificial Intelligence in Controversial Drone-Targeting Project;04/02/2019;https://theintercept.com/2019/02/04/google-ai-project-maven-figure-eight/;;;;;;;;;;;;;;;;;;;;;;;;;;;;;;;;;;;;;;;;;;;;;;;;;;;
webpage;2019;The Intercept;Fang, Lee;Google Hedges on Promise to End Controversial Involvement in Military Drone Contract;01/03/2019;https://theintercept.com/2019/03/01/google-project-maven-contract/;;;;;;;;;;;;;;;;;;;;;;;;;;;;;;;;;;;;;;;;;;;;;;;;;;;
webpage;2019;The Intercept;Fang, Lee;Defense Tech Startup Founded by Trump's Most Prominent Silicon Valley Supporters Wins Secretive Military AI Contract;09/03/2019;https://theintercept.com/2019/03/09/anduril-industries-project-maven-palmer-luckey/;;;;;;;;;;;;;;;;;;;;;;;;;;;;;;;;;;;;;;;;;;;;;;;;;;;
webpage;2019;The Intercept;Fang, Lee;Google Continues Investments in Military and Police AI Technology Through Venture Capital Arm;23/07/2019;https://theintercept.com/2019/07/23/google-ai-gradient-ventures/;;;;;;;;;;;;;;;;;;;;;;;;;;;;;;;;;;;;;;;;;;;;;;;;;;;
webpage;2019;The Intercept;Ochigame, Rodrigo;How Big Tech Manipulates Academia to Avoid Regulation;20/12/2019;https://theintercept.com/2019/12/20/mit-ethical-ai-artificial-intelligence/;;;;;;;;;;;;;;;;;;;;;;;;;;;;;;;;;;;;;;;;;;;;;;;;;;;
webpage;2019;The Register;Nichols, Shaun;Web body mulls halving HTTPS cert lifetimes. That screaming in the distance is HTTPS cert sellers fearing orgs will bail for Let's Encrypt;13/08/2019;https://www.theregister.com/2019/08/13/site_certificate_lifetimes/;;;;;;;;;;;;;;;;;;;;;;;;;;;;;;;;;;;;;;;;;;;;;;;;;;;
webpage;2019;The SSL Store;Nohe, Patrick;The TLS Handshake: Taking a closer look - Hashed Out by The SSL Store™;30/04/2019;https://web.archive.org/web/20220304230920/https://www.thesslstore.com/blog/explaining-ssl-handshake/;;;;;;;;;;;;;;;;;;;;;;;;;;;;;;;;;;;;;;;;;;;;;;;;;;;
webpage;2019;The Verge;Kelly, Makena;Google hired microworkers to train its controversial Project Maven AI;04/02/2019;https://www.theverge.com/2019/2/4/18211155/google-microworkers-maven-ai-train-pentagon-pay-salary;;;;;;;;;;;;;;;;;;;;;;;;;;;;;;;;;;;;;;;;;;;;;;;;;;;
webpage;2019;The Verge;Vincent, James;OpenAI has published the text-generating AI it said was too dangerous to share;07/11/2019;https://www.theverge.com/2019/11/7/20953040/openai-text-generation-ai-gpt-2-full-model-release-1-5b-parameters;;;;;;;;;;;;;;;;;;;;;;;;;;;;;;;;;;;;;;;;;;;;;;;;;;;
webpage;2019;U.S. Department of Defense;Shanahan, Lt. Gen. Jack;Lt. Gen. Jack Shanahan Media Briefing on A.I.-Related Initiatives within the Department of;10/08/2019;https://www.defense.gov/News/Transcripts/Transcript/Article/1949362/lt-gen-jack-shanahan-media-briefing-on-ai-related-initiatives-within-the-depart/https%3A%2F%2Fwww.defense.gov%2FNews%2FTranscripts%2FTranscript%2FArticle%2F1949362%2Flt-gen-jack-shanahan-media-briefing-on-ai-related-initiatives-within-the-depart%2F;;;;;;;;;;;;;;;;;;;;;;;;;;;;;;;;;;;;;;;;;;;;;;;;;;;
webpage;2019;;Bohm, Jakob;Re: How harsh (in general) should Mozilla be towards CAs?;09/11/2019;https://www.mail-archive.com/dev-security-policy@lists.mozilla.org/msg10805.html;;;;;;;;;;;;;;;;;;;;;;;;;;;;;;;;;;;;;;;;;;;;;;;;;;;
webpage;2019;;Office of the Secretary of Defense;Exhibit R-2. RDTandE Budget Item Justification, Intelligence Capabilities and Innovation.;01/02/2019;https://www.dacis.com/budget/budget_pdf/FY20/RDTE/D/0305245D8Z_187.pdf;;;;;;;;;;;;;;;;;;;;;;;;;;;;;;;;;;;;;;;;;;;;;;;;;;;
webpage;2019;;OpenAI;Better language models and their implications;14/02/2019;https://openai.com/index/better-language-models/;;;;;;;;;;;;;;;;;;;;;;;;;;;;;;;;;;;;;;;;;;;;;;;;;;;
webpage;2019;;van den Berge, Jochem;Pre-Incident report: PKIoverheid Serial Number Entropy;13/03/2019;https://groups.google.com/g/mozilla.dev.security.policy/c/r9C_Mh9Du_g/m/nZ50IA1mBQAJ;;;;;;;;;;;;;;;;;;;;;;;;;;;;;;;;;;;;;;;;;;;;;;;;;;;
webpage;2019;;van den Berge, Jochem;Pre-Incident report: PKIoverheid Serial Number Entropy;29/03/2019;https://groups.google.com/g/mozilla.dev.security.policy/c/r9C_Mh9Du_g/m/nZ50IA1mBQAJ;;;;;;;;;;;;;;;;;;;;;;;;;;;;;;;;;;;;;;;;;;;;;;;;;;;
webpage;2019;;van den Berge, Jochem;Pre-Incident report: PKIoverheid Serial Number Entropy;22/03/2019;https://groups.google.com/g/mozilla.dev.security.policy/c/r9C_Mh9Du_g/m/iPRGzNd8BwAJ;;;;;;;;;;;;;;;;;;;;;;;;;;;;;;;;;;;;;;;;;;;;;;;;;;;
webpage;2019;;van den Berge, Jochem;Pre-Incident report: PKIoverheid Serial Number Entropy;13/03/2019;https://groups.google.com/g/mozilla.dev.security.policy/c/r9C_Mh9Du_g/m/xtMrK1viCgAJ;;;;;;;;;;;;;;;;;;;;;;;;;;;;;;;;;;;;;;;;;;;;;;;;;;;
webpage;2020;Apple Support;Apple Support (UK);About upcoming limits on trusted certificates;03/11/2020;https://support.apple.com/en-gb/102028;;;;;;;;;;;;;;;;;;;;;;;;;;;;;;;;;;;;;;;;;;;;;;;;;;;
webpage;2020;BBC;Shead, Sam;Researchers: Are we on the cusp of an ‘AI winter’?;12/01/2020;https://www.bbc.com/news/technology-51064369;;;;;;;;;;;;;;;;;;;;;;;;;;;;;;;;;;;;;;;;;;;;;;;;;;;
webpage;2020;Bugzilla;;"1684158 - PKIoverheid: Removal of websites trust bit for ""Staat der Nederlanden Root CA – G3""";24/12/2020;https://bugzilla.mozilla.org/show_bug.cgi?id=1684158;;;;;;;;;;;;;;;;;;;;;;;;;;;;;;;;;;;;;;;;;;;;;;;;;;;
webpage;2020;Bugzilla;;1649964 - PKIoverheid: Incorrect OCSP Delegated Responder Certificate;01/07/2020;https://bugzilla.mozilla.org/show_bug.cgi?id=1649964;;;;;;;;;;;;;;;;;;;;;;;;;;;;;;;;;;;;;;;;;;;;;;;;;;;
webpage;2020;C4ISRNet;Strout, Nathan;This platform will help train AI algorithms for the military;20/05/2020;https://www.c4isrnet.com/artificial-intelligence/2020/05/20/this-platform-will-help-train-ai-algorithms-for-the-military/;;;;;;;;;;;;;;;;;;;;;;;;;;;;;;;;;;;;;;;;;;;;;;;;;;;
webpage;2020;CA/Browser Forum;;Ballot SC031: Browser Alignment;16/07/2020;https://cabforum.org/2020/07/16/ballot-sc031-browser-alignment/;;;;;;;;;;;;;;;;;;;;;;;;;;;;;;;;;;;;;;;;;;;;;;;;;;;
webpage;2020;CAB Forum;;Ballot SC31: Browser Alignment;16/07/2020;https://cabforum.org/2020/07/16/ballot-sc31-browser-alignment/;;;;;;;;;;;;;;;;;;;;;;;;;;;;;;;;;;;;;;;;;;;;;;;;;;;
webpage;2020;Chief Information Officer - U.S. Department of Defense;Vergun, David;Delivering AI to Warfighters Is Strategic Imperative;10/09/2020;https://dodcio.defense.gov/In-the-News/News-Display/Article/2347200/delivering-ai-to-warfighters-is-strategic-imperative/https%3A%2F%2Fdodcio.defense.gov%2FIn-the-News%2FNews-Display%2FArticle%2F2347200%2Fdelivering-ai-to-warfighters-is-strategic-imperative%2F;;;;;;;;;;;;;;;;;;;;;;;;;;;;;;;;;;;;;;;;;;;;;;;;;;;
webpage;2020;Chromium;Sleevi, Ryan;Enforce 398-day validity for certificates issued on-or-after 2020-09-01 (2258372) · Gerrit Code Review;23/06/2020;https://chromium-review.googlesource.com/c/chromium/src/+/2258372;;;;;;;;;;;;;;;;;;;;;;;;;;;;;;;;;;;;;;;;;;;;;;;;;;;
webpage;2020;chromium/src - Git at Google;Sleevi, Ryan;ae4d6809912f8171b23f6aa43c6a4e8e627de784;23/06/2020;https://chromium.googlesource.com/chromium/src/+/ae4d6809912f8171b23f6aa43c6a4e8e627de784?ref=scotthelme.co.uk;;;;;;;;;;;;;;;;;;;;;;;;;;;;;;;;;;;;;;;;;;;;;;;;;;;
webpage;2020;Coursera;Ng, Andrew;AI For Everyone;2020;https://www.coursera.org/learn/ai-for-everyone#about;;;;;;;;;;;;;;;;;;;;;;;;;;;;;;;;;;;;;;;;;;;;;;;;;;;
webpage;2020;CRN;Tsidulko, Joseph;Google Cloud Wins Multimillion-Dollar Pentagon Cybersecurity Contract | CRN;20/05/2020;https://www.crn.com/news/cloud/google-cloud-wins-multimillion-dollar-pentagon-cybersecurity-contract;;;;;;;;;;;;;;;;;;;;;;;;;;;;;;;;;;;;;;;;;;;;;;;;;;;
webpage;2020;Defense One;Tucker, Patrick;Inside the Army’s Fearless, Messy, Networked Warfare Experiment;25/09/2020;https://www.defenseone.com/technology/2020/09/inside-armys-fearless-messy-networked-warfare-experiment/168770/;;;;;;;;;;;;;;;;;;;;;;;;;;;;;;;;;;;;;;;;;;;;;;;;;;;
webpage;2020;DigiCert;DigiCert;Working with Delegated OCSP Responders and EKU Chaining;09/07/2020;https://www.digicert.com/blog/working-with-delegated-ocsp-responders-and-eku-chaining;;;;;;;;;;;;;;;;;;;;;;;;;;;;;;;;;;;;;;;;;;;;;;;;;;;
webpage;2020;European Commission;European Commission;White Paper on Artificial Intelligence – a European approach to excellence and trust | Shaping Europe’s digital future;19/02/2020;https://digital-strategy.ec.europa.eu/en/consultations/white-paper-artificial-intelligence-european-approach-excellence-and-trust;;;;;;;;;;;;;;;;;;;;;;;;;;;;;;;;;;;;;;;;;;;;;;;;;;;
webpage;2020;Federal News Network;Sharma, Manu;Why Congress, DoD should focus on training data platforms to make AI tools more valuable;15/06/2020;https://federalnewsnetwork.com/commentary/2020/06/why-congress-dod-should-focus-on-training-data-platforms-to-make-ai-tools-more-valuable/;;;;;;;;;;;;;;;;;;;;;;;;;;;;;;;;;;;;;;;;;;;;;;;;;;;
webpage;2020;GitHub;Sleevi, Ryan;SC31 - Browser Alignment by sleevi · Pull Request #195 · cabforum/servercert;17/07/2020;https://github.com/cabforum/servercert/pull/195;;;;;;;;;;;;;;;;;;;;;;;;;;;;;;;;;;;;;;;;;;;;;;;;;;;
webpage;2020;Google Cloud Blog;Manor, Eyal;Anthos latest release adds hybrid AI and other features;25/08/2020;https://cloud.google.com/blog/topics/google-cloud-next/latest-anthos-release-adds-hybrid-ai-and-other-features;;;;;;;;;;;;;;;;;;;;;;;;;;;;;;;;;;;;;;;;;;;;;;;;;;;
webpage;2020;Google The Keyword;Walker, Kent;Responding to the European Commission’s AI white paper;28/05/2020;https://blog.google/around-the-globe/google-europe/responding-to-the-european-commissions-ai-white-paper/;;;;;;;;;;;;;;;;;;;;;;;;;;;;;;;;;;;;;;;;;;;;;;;;;;;
webpage;2020;MIT Technology Review;Hao, Karen;The two-year fight to stop Amazon from selling face recognition to the police;12/06/2020;https://www.technologyreview.com/2020/06/12/1003482/amazon-stopped-selling-police-face-recognition-fight/;;;;;;;;;;;;;;;;;;;;;;;;;;;;;;;;;;;;;;;;;;;;;;;;;;;
webpage;2020;MIT Technology Review;Hao, Karen;We read the paper that forced Timnit Gebru out of Google. Here’s what it says.;04/12/2020;https://www.technologyreview.com/2020/12/04/1013294/google-ai-ethics-research-paper-forced-out-timnit-gebru/;;;;;;;;;;;;;;;;;;;;;;;;;;;;;;;;;;;;;;;;;;;;;;;;;;;
webpage;2020;Modern War Institute;"Clarke, Richard H.; Shultz, Gen Richard D.";Big Data at War: Special Operations Forces, Project Maven, and Twenty-First-Century Warfare;25/08/2020;https://mwi.westpoint.edu/big-data-at-war-special-operations-forces-project-maven-and-twenty-first-century-warfare/;;;;;;;;;;;;;;;;;;;;;;;;;;;;;;;;;;;;;;;;;;;;;;;;;;;
webpage;2020;Mozilla Security Blog;Wilson, Ben;Reducing TLS Certificate Lifespans to 398 Days;09/07/2020;https://blog.mozilla.org/security/2020/07/09/reducing-tls-certificate-lifespans-to-398-days;;;;;;;;;;;;;;;;;;;;;;;;;;;;;;;;;;;;;;;;;;;;;;;;;;;
webpage;2020;Nationaal Cyber Security Centrum;Nationaal Cyber Security Centrum;Aantal certificaten voldoen niet aan de afgesproken richtlijnen - Nieuwsbericht - Nationaal Cyber Security Centrum;08/07/2020;https://www.ncsc.nl/actueel/nieuws/2020/juli/8/aantal-certificaten-voldoen-niet-aan-de-afgesproken-richtlijnen;;;;;;;;;;;;;;;;;;;;;;;;;;;;;;;;;;;;;;;;;;;;;;;;;;;
webpage;2020;NBC News;Glaser, April;Google, Amazon, and Microsoft hold thousands of contracts with the U.S. military and federal law enforcement, new research shows;08/07/2020;https://www.nbcnews.com/tech/tech-news/thousands-contracts-highlight-quiet-ties-between-big-tech-u-s-n1233171;;;;;;;;;;;;;;;;;;;;;;;;;;;;;;;;;;;;;;;;;;;;;;;;;;;
webpage;2020;RUSI.org;Sherman, Sam;Coordinating Artificial Intelligence: Six Lessons from the US;26/08/2020;https://rusi.orghttps://rusi.org;;;;;;;;;;;;;;;;;;;;;;;;;;;;;;;;;;;;;;;;;;;;;;;;;;;
webpage;2020;Security.NL;Security.NL;Logius onderzoekt PKIoverheid-certificaten die niet aan richtlijnen voldoen;06/07/2020;https://www.security.nl/posting/663584/Logius+onderzoekt+PKIoverheid-certificaten+die+niet+aan+richtlijnen+voldoen;;;;;;;;;;;;;;;;;;;;;;;;;;;;;;;;;;;;;;;;;;;;;;;;;;;
webpage;2020;Security.NL;Security.NL;Logius komt met oplossing voor PKIoverheid-certificaten die niet aan de regels voldoen;10/07/2020;https://www.security.nl/posting/664011/Logius+komt+met+oplossing+voor+PKIoverheid-certificaten+die+niet+aan+de+regels+voldoen;;;;;;;;;;;;;;;;;;;;;;;;;;;;;;;;;;;;;;;;;;;;;;;;;;;
webpage;2020;Tech Inquiry;Poulson, Jack;Reports of a Silicon Valley/Military Divide Have Been Greatly Exaggerated;07/07/2020;https://techinquiry.org/SiliconValley-Military/#direct-contracting-fpds-contract-values;;;;;;;;;;;;;;;;;;;;;;;;;;;;;;;;;;;;;;;;;;;;;;;;;;;
webpage;2020;The Register;Francisco, Shaun Nichols in San;Remember when we warned in February Apple will crack down on long-life HTTPS certs? It's happening: Chrome, Firefox ready to join in, too;30/06/2020;https://www.theregister.com/2020/06/30/tls_cert_lifespan/;;;;;;;;;;;;;;;;;;;;;;;;;;;;;;;;;;;;;;;;;;;;;;;;;;;
webpage;2020;The Verge;Schiffer, Zoë;Google fires prominent AI ethicist Timnit Gebru;03/12/2020;https://www.theverge.com/2020/12/3/22150355/google-fires-timnit-gebru-facial-recognition-ai-ethicist;;;;;;;;;;;;;;;;;;;;;;;;;;;;;;;;;;;;;;;;;;;;;;;;;;;
webpage;2020;War on the Rocks;Cook, Matthew;The Humble Task of Implementation is the Key to AI Dominance;29/06/2020;https://warontherocks.com/2020/06/the-humble-task-of-implementation-is-the-key-to-ai-dominance/;;;;;;;;;;;;;;;;;;;;;;;;;;;;;;;;;;;;;;;;;;;;;;;;;;;
webpage;2020;War on the Rocks;Cruickshank, Iain J.;The ABCs of AI-Enabled Intelligence Analysis;14/02/2020;http://warontherocks.com/2020/02/the-abcs-of-ai-enabled-intelligence-analysis/;;;;;;;;;;;;;;;;;;;;;;;;;;;;;;;;;;;;;;;;;;;;;;;;;;;
webpage;2020;War on the Rocks;Perkins, Jim;Trust Algorithms? The Army Doesn’t Even Trust Its Own AI Developers;07/10/2020;https://warontherocks.com/2020/10/trust-algorithms-the-army-doesnt-even-trust-its-own-ai-developers/;;;;;;;;;;;;;;;;;;;;;;;;;;;;;;;;;;;;;;;;;;;;;;;;;;;
webpage;2020;Wired;Simonite, Tom;The Dark Side of Big Tech’s Funding for AI Research;10/12/2020;https://www.wired.com/story/dark-side-big-tech-funding-ai-research/;;;;;;;;;;;;;;;;;;;;;;;;;;;;;;;;;;;;;;;;;;;;;;;;;;;
webpage;2020;ZDNET;Cimpanu, Catalin;Apple strong-arms entire CA industry into one-year certificate lifespans;28/07/2020;https://www.zdnet.com/article/apple-strong-arms-entire-ca-industry-into-one-year-certificate-lifespans/;;;;;;;;;;;;;;;;;;;;;;;;;;;;;;;;;;;;;;;;;;;;;;;;;;;
webpage;2020;ZDNET;Cimpanu, Catalin;Chrome will soon have its own dedicated certificate root store;31/10/2020;https://www.zdnet.com/article/chrome-will-soon-have-its-own-dedicated-certificate-root-store/;;;;;;;;;;;;;;;;;;;;;;;;;;;;;;;;;;;;;;;;;;;;;;;;;;;
webpage;2021;Ars Technica;Chant, Tim De;Pentagon kills Microsoft’s $10B JEDI cloud contract, says tech is now outdated;06/07/2021;https://arstechnica.com/tech-policy/2021/07/dod-cancels-10b-jedi-cloud-contract-with-microsoft-says-tech-already-outdated/;;;;;;;;;;;;;;;;;;;;;;;;;;;;;;;;;;;;;;;;;;;;;;;;;;;
